{"run_id":"pass1-s06-b-real-p01-LEARNER_B-realistic_student-s06","outer_pass":1,"learner_id":"LEARNER_B","mode":"realistic_student","section_id":"numpy","packet_sha":"9986249a18b2e2cd5b2f807bbfd59b841da928dcdfd8dc2739e8c874e16df26b","context_manifest_id":"pass1-s06-b-real-p01-LEARNER_B-realistic_student-s06","first_use_observations":[{"term":"slice negativo","location_ref":"packet.json.active.theory[S06-T1-A]","status":"UNDERSTOOD","learner_paraphrase":"Un slice como `rows[-3:]` crea una lista con las últimas filas sin cambiar la lista original; el caso n=0 necesita tratamiento especial.","evidence_refs":["packet.json.active.theory[S06-T1-A]","packet.json.active.iDo.steps[S06-T1-A-DEMO]"],"blocking":false,"confidence":0.96},{"term":"tuple como contrato inmutable","location_ref":"packet.json.active.theory[S06-T1-A]","status":"UNDERSTOOD","learner_paraphrase":"Una tuple sirve para columnas fijas porque no admite append; para extenderla creo otra tuple.","evidence_refs":["packet.json.active.theory[S06-T1-A]","packet.json.active.weDo.exercises[S06-T1-A-E2]"],"blocking":false,"confidence":0.94},{"term":"copia superficial y profunda","location_ref":"packet.json.active.theory[S06-T1-B]","status":"UNDERSTOOD","learner_paraphrase":"La copia superficial separa solo el contenedor exterior; objetos anidados siguen compartidos. deepcopy separa también esos objetos interiores.","evidence_refs":["packet.json.active.theory[S06-T1-B]","packet.json.active.iDo.steps[S06-T1-B-DEMO]"],"blocking":false,"confidence":0.95},{"term":"índice id→fila","location_ref":"packet.json.active.theory[S06-T2-A]","status":"UNDERSTOOD","learner_paraphrase":"Un dict permite localizar una fila por ID sin recorrer repetidamente la lista, pero un ID repetido puede sobrescribir evidencia si no se detecta antes.","evidence_refs":["packet.json.active.theory[S06-T2-A]","packet.json.active.iDo.steps[S06-T2-A-DEMO]"],"blocking":false,"confidence":0.94},{"term":"deduplicación con conflictos","location_ref":"packet.json.active.theory[S06-T2-B]","status":"UNDERSTOOD","learner_paraphrase":"Conservo la primera fila única; una repetición idéntica no agrega conflicto y el mismo ID con contenido distinto se registra para revisión.","evidence_refs":["packet.json.active.theory[S06-T2-B]","packet.json.active.iDo.steps[S06-T2-B-DEMO]"],"blocking":false,"confidence":0.96},{"term":"aplanar estructuras anidadas","location_ref":"packet.json.active.theory[S06-T3-A]","status":"UNDERSTOOD","learner_paraphrase":"Al crear una fila por transacción debo repetir client_id para no perder la relación con su cliente.","evidence_refs":["packet.json.active.theory[S06-T3-A]","packet.json.active.iDo.steps[S06-T3-A-DEMO]"],"blocking":false,"confidence":0.96},{"term":"missing frente a vacío","location_ref":"packet.json.active.theory[S06-T3-B]","status":"UNDERSTOOD","learner_paraphrase":"Una clave ausente, None, un string vacío, cero y una lista vacía no significan lo mismo; la política debe compararlos explícitamente.","evidence_refs":["packet.json.active.theory[S06-T3-B]","packet.json.active.iDo.steps[S06-T3-B-DEMO]"],"blocking":false,"confidence":0.96},{"term":"salida JSON determinista","location_ref":"packet.json.active.theory[S06-T4-B]","status":"UNDERSTOOD","learner_paraphrase":"Ordeno las filas relevantes y uso sort_keys para que entradas equivalentes produzcan el mismo texto JSON.","evidence_refs":["packet.json.active.theory[S06-T4-B]","packet.json.active.iDo.steps[S06-T4-B-DEMO]"],"blocking":false,"confidence":0.94}],"exercise_attempts":[{"exercise_id":"S06-T1-A-E1","status":"CANNOT_VERIFY","answer_or_code":"txs = [10, 20, 30, 40, 50]\nventana = txs[-2:]\nprint(ventana)\nprint(len(ventana))\nempty = []\nv0 = empty[-2:]\nprint(v0)\nprint(len(v0))","evidence_refs":["packet.json.active.weDo.exercises[S06-T1-A-E1]","packet.json.active.theory[S06-T1-A]"],"concepts_used":["slice negativo","len"],"assumptions":["La salida requiere ejecutar Python para confirmarse."],"confidence":0.98,"observed_output":"","questions":[],"suspected_missing_prerequisites":[]},{"exercise_id":"S06-T1-A-E2","status":"CANNOT_VERIFY","answer_or_code":"headers = ['id', 'monto']\nKEYS = tuple(headers)\nmore = KEYS + ('canal',)\nprint('KEYS', KEYS)\nprint('more', more)\nprint('KEYS sigue', KEYS)","evidence_refs":["packet.json.active.weDo.exercises[S06-T1-A-E2]","packet.json.active.theory[S06-T1-A]"],"concepts_used":["tuple","inmutabilidad"],"assumptions":["No se ejecutó el código."],"confidence":0.97,"observed_output":"","questions":[],"suspected_missing_prerequisites":[]},{"exercise_id":"S06-T1-A-E3","status":"CANNOT_VERIFY","answer_or_code":"ids = ('C001', 'C002')\ntry:\n    ids.append('C003')\nexcept AttributeError as e:\n    print(type(e).__name__, e)\nids_lista = list(ids)\nids_lista.append('C003')\nprint(ids_lista)","evidence_refs":["packet.json.active.weDo.exercises[S06-T1-A-E3]"],"concepts_used":["tuple","AttributeError","list"],"assumptions":["El mensaje exacto de AttributeError depende de la ejecución."],"confidence":0.95,"observed_output":"","questions":[],"suspected_missing_prerequisites":[]},{"exercise_id":"S06-T1-B-E1","status":"CANNOT_VERIFY","answer_or_code":"fila = ('C001', 'Lima', 10)\ncid, region, monto = fila\nprint(cid, region, monto)","evidence_refs":["packet.json.active.weDo.exercises[S06-T1-B-E1]","packet.json.active.theory[S06-T1-B]"],"concepts_used":["unpacking"],"assumptions":["No se ejecutó el código."],"confidence":0.99,"observed_output":"","questions":[],"suspected_missing_prerequisites":[]},{"exercise_id":"S06-T1-B-E2","status":"CANNOT_VERIFY","answer_or_code":"xs = [1, 2]\nalias = xs\ncopia = xs.copy()\nalias.append(3)\nprint('tras alias', xs, copia)\ncopia.append(4)\nprint('tras copia', xs, copia)","evidence_refs":["packet.json.active.weDo.exercises[S06-T1-B-E2]","packet.json.active.theory[S06-T1-B]"],"concepts_used":["alias","copia superficial"],"assumptions":["No se ejecutó el código."],"confidence":0.98,"observed_output":"","questions":[],"suspected_missing_prerequisites":[]},{"exercise_id":"S06-T1-B-E3","status":"CANNOT_VERIFY","answer_or_code":"import copy\nrows = [{'id': 'C1', 'tags': ['a']}]\nshallow = rows.copy()\nshallow[0]['tags'].append('s')\nprint('orig tras shallow tags', rows)\ndeep = copy.deepcopy(rows)\ndeep[0]['tags'].append('d')\nprint('orig', rows)\nprint('deep', deep)","evidence_refs":["packet.json.active.weDo.exercises[S06-T1-B-E3]","packet.json.active.theory[S06-T1-B]"],"concepts_used":["shallow copy","deepcopy"],"assumptions":["No se ejecutó el código."],"confidence":0.98,"observed_output":"","questions":[],"suspected_missing_prerequisites":[]},{"exercise_id":"S06-T2-A-E1","status":"CANNOT_VERIFY","answer_or_code":"pares = [('C001', 'Lima'), ('C002', 'Cusco')]\nd = dict(pares)\nprint(d)\nprint(d['C002'])","evidence_refs":["packet.json.active.weDo.exercises[S06-T2-A-E1]","packet.json.active.theory[S06-T2-A]"],"concepts_used":["dict","lookup por clave"],"assumptions":["No se ejecutó el código."],"confidence":0.99,"observed_output":"","questions":[],"suspected_missing_prerequisites":[]},{"exercise_id":"S06-T2-A-E2","status":"CANNOT_VERIFY","answer_or_code":"idx = {'C001': 'Ana'}\nprint(idx.get('C001', 'N/A'))\nprint(idx.get('C999', 'N/A'))\ntry:\n    print(idx['C999'])\nexcept KeyError as e:\n    print('KeyError', e)","evidence_refs":["packet.json.active.weDo.exercises[S06-T2-A-E2]","packet.json.active.theory[S06-T2-A]"],"concepts_used":["dict.get","KeyError"],"assumptions":["La representación exacta del KeyError requiere ejecución."],"confidence":0.98,"observed_output":"","questions":[],"suspected_missing_prerequisites":[]},{"exercise_id":"S06-T2-A-E3","status":"CANNOT_VERIFY","answer_or_code":"defaults = {'retry': 1, 'timeout': 30}\noverride = {'retry': 5}\nmerged = {**defaults, **override}\nprint('merged', merged)\nprint('defaults intacto', defaults)","evidence_refs":["packet.json.active.weDo.exercises[S06-T2-A-E3]","packet.json.active.theory[S06-T2-A]"],"concepts_used":["dict merge","no mutación"],"assumptions":["No se ejecutó el código."],"confidence":0.98,"observed_output":"","questions":[],"suspected_missing_prerequisites":[]},{"exercise_id":"S06-T2-B-E1","status":"CANNOT_VERIFY","answer_or_code":"emails = ['a@ex.com', 'b@ex.com', 'a@ex.com']\nunicos = sorted(set(emails))\nprint(unicos)","evidence_refs":["packet.json.active.weDo.exercises[S06-T2-B-E1]","packet.json.active.theory[S06-T2-B]"],"concepts_used":["set","sorted","deduplicación"],"assumptions":["No se ejecutó el código."],"confidence":0.99,"observed_output":"","questions":[],"suspected_missing_prerequisites":[]},{"exercise_id":"S06-T2-B-E2","status":"CANNOT_VERIFY","answer_or_code":"a = {'a@ex.com', 'b@ex.com', 'c@ex.com'}\nb = {'b@ex.com', 'c@ex.com', 'd@ex.com'}\nprint('inter', sorted(a & b))\nprint('symdiff', sorted(a ^ b))","evidence_refs":["packet.json.active.weDo.exercises[S06-T2-B-E2]","packet.json.active.theory[S06-T2-B]"],"concepts_used":["set intersection","symmetric difference","sorted"],"assumptions":["No se ejecutó el código."],"confidence":0.98,"observed_output":"","questions":[],"suspected_missing_prerequisites":[]},{"exercise_id":"S06-T2-B-E3","status":"CANNOT_VERIFY","answer_or_code":"def dedup_report(rows, key='id'):\n    seen = {}\n    unique = []\n    conflicts = []\n    for r in rows:\n        k = r[key]\n        if k not in seen:\n            seen[k] = r\n            unique.append(r)\n        elif seen[k] != r:\n            conflicts.append({'id': k, 'kept': seen[k], 'other': r})\n    return {'unique': unique, 'conflicts': conflicts}","evidence_refs":["packet.json.active.weDo.exercises[S06-T2-B-E3]","packet.json.active.theory[S06-T2-B]","packet.json.active.iDo.steps[S06-T2-B-DEMO]"],"concepts_used":["dict seen","unique","conflicts"],"assumptions":["El fixture debe ejecutarse para confirmar exactamente un conflicto."],"confidence":0.97,"observed_output":"","questions":[],"suspected_missing_prerequisites":[]},{"exercise_id":"S06-T3-A-E1","status":"CANNOT_VERIFY","answer_or_code"